rel_type	rel_sense	conn_text	arg1_text	arg2_text
Explicit	Expansion.Conjunction	и	Мир изменяется основательным образом	я беспокоюсь , что инвесторы не уделяют достаточного внимания некоторым крупнейшим двигателям перемен , особенно , когда речь идёт об устойчивости развития
Explicit	Expansion.Level-of-detail.Arg2-as-detail	особенно	инвесторы не уделяют достаточного внимания некоторым крупнейшим двигателям перемен	когда речь идёт об устойчивости развития
Explicit	Temporal.Synchronous	когда	инвесторы не уделяют достаточного внимания некоторым крупнейшим двигателям перемен	речь идёт об устойчивости развития
Implicit	Expansion.Level-of-detail.Arg2-as-detail	in particular	Мир изменяется основательным образом , и я беспокоюсь , что инвесторы не уделяют достаточного внимания некоторым крупнейшим двигателям перемен , особенно , когда речь идёт об устойчивости развития	Под устойчивостью я понимаю такие по-настоящему пикантные моменты , как экологические и социальные проблемы и корпоративное управление
Implicit	Expansion.Conjunction	and	Под устойчивостью я понимаю такие по-настоящему пикантные моменты , как экологические и социальные проблемы и корпоративное управление	Я считаю безответственным игнорировать эти вещи , ведь подобным образом можно подвергнуть опасности будущие доходы в долгосрочной перспективе
Explicit	Contingency.Cause.Reason	ведь	Я считаю безответственным игнорировать эти вещи	подобным образом можно подвергнуть опасности будущие доходы в долгосрочной перспективе
Implicit	Comparison.Concession.Arg2-as-denier	but	Я считаю безответственным игнорировать эти вещи , ведь подобным образом можно подвергнуть опасности будущие доходы в долгосрочной перспективе	Вот что может вас удивить : баланс власти , которая действительно может повлиять на устойчивость развития , сохраняется за институциональными инвесторами — крупными инвесторами , такими как пенсионные фонды , учреждения и благотворительные фонды
Implicit	Expansion.Conjunction	and	Вот что может вас удивить : баланс власти , которая действительно может повлиять на устойчивость развития , сохраняется за институциональными инвесторами — крупными инвесторами , такими как пенсионные фонды , учреждения и благотворительные фонды	Я верю , что инвестирование с расчётом на устойчивость гораздо проще , чем думается , более эффективно , чем кажется , и важнее , чем можно себе представить
Implicit	Expansion.Conjunction	and	Я верю , что инвестирование с расчётом на устойчивость гораздо проще , чем думается , более эффективно , чем кажется , и важнее , чем можно себе представить	Позвольте напомнить о том , что мы уже знаем
Implicit	Expansion.Level-of-detail.Arg2-as-detail	in particular	Позвольте напомнить о том , что мы уже знаем	Население нашей планеты одновременно увеличивается и стареет
Implicit	Expansion.Conjunction	and	Население нашей планеты одновременно увеличивается и стареет	На данный момент нас 7 миллиардов человек , намеренных стать 10 миллиардами к концу века
Implicit	Expansion.Conjunction	and	На данный момент нас 7 миллиардов человек , намеренных стать 10 миллиардами к концу века	Мы потребляем природные ресурсы быстрее , чем они могут быть пополнены ; а загрязнение окружающей среды , в основном ответственное за изменение климата , продолжает расти
Explicit	Expansion.Conjunction	а	Мы потребляем природные ресурсы быстрее , чем они могут быть пополнены	загрязнение окружающей среды , в основном ответственное за изменение климата , продолжает расти
Implicit	Contingency.Cause.Result	so	Мы потребляем природные ресурсы быстрее , чем они могут быть пополнены ; а загрязнение окружающей среды , в основном ответственное за изменение климата , продолжает расти	Понятно , существуют экологические и социальные проблемы , но это ещё не всё
Explicit	Comparison.Concession.Arg2-as-denier	но	существуют экологические и социальные проблемы	это ещё не всё
Explicit	Expansion.Conjunction	также	Понятно , существуют экологические и социальные проблемы , но это ещё не всё	
Implicit	Expansion.Conjunction	and	Они также являются и экономическими проблемами , что делает их относящимися к рискам и доходам	Они по-настоящему сложны и могут казаться весьма далёкими , так что есть соблазн сделать так : спрятать голову в песок и не думать об этом
Explicit	Expansion.Conjunction	и	по-настоящему сложны	могут казаться весьма далёкими
Explicit	Contingency.Cause.Result	так что	Они по-настоящему сложны и могут казаться весьма далёкими	есть соблазн сделать так : спрятать голову в песок и не думать об этом
Explicit	Expansion.Conjunction	и	спрятать голову в песок	не думать об этом
Implicit	Comparison.Concession.Arg2-as-denier	but	спрятать голову в песок и не думать об этом	Сопротивляйтесь , если можете
Explicit	Contingency.Condition.Arg2-as-cond	если	Сопротивляйтесь	можете
Implicit	Expansion.Conjunction	and	Сопротивляйтесь , если можете	Не повторяйте этого дома
Implicit	Expansion.Level-of-detail.Arg2-as-detail	in particular	Это заставляет меня сомневаться , соответствуют ли правила инвестирования сегодняшнего дня целям завтрашнего	Известно , что инвесторы , когда оценивают компанию и решают , инвестировать ли в неё или нет , основываются на финансовой информации , таких показателях , как рост продаж , денежный поток , доля рынка , определение ценности — всякие подобные секси штучки
Explicit	Temporal.Synchronous	когда		оценивают компанию и решают , инвестировать ли в неё или нет
Explicit	Expansion.Conjunction	и	оценивают компанию	решают
Explicit	Expansion.Disjunction	или	инвестировать ли в неё	нет
Implicit	Contingency.Cause.Reason	because	Они , конечно , существенны , но недостаточны	Инвесторам стоит также оценивать рабочие характеристики , которые мы называем ЭОУ : экология , общество и управление
Implicit	Expansion.Level-of-detail.Arg2-as-detail	specifically	Инвесторам стоит также оценивать рабочие характеристики , которые мы называем ЭОУ : экология , общество и управление	"Экология включает в себя потребление энергии , доступность воды , отходы и загрязнение , просто эффективное использование ресурсов .
Общество включает человеческий капитал , такие вещи , как вовлечение сотрудников и инновационный потенциал , также управление сетями поставок , и трудовые и человеческие права .
Управление относится к контролю компаний их руководством и инвесторами"
Implicit	Expansion.Conjunction	and	Экология включает в себя потребление энергии , доступность воды , отходы и загрязнение , просто эффективное использование ресурсов	Общество включает человеческий капитал , такие вещи , как вовлечение сотрудников и инновационный потенциал , также управление сетями поставок , и трудовые и человеческие права
Implicit	Expansion.Conjunction	and	Общество включает человеческий капитал , такие вещи , как вовлечение сотрудников и инновационный потенциал , также управление сетями поставок , и трудовые и человеческие права	Управление относится к контролю компаний их руководством и инвесторами
Implicit	Expansion.Level-of-detail.Arg1-as-detail	in sum	"Экология включает в себя потребление энергии , доступность воды , отходы и загрязнение , просто эффективное использование ресурсов .
Общество включает человеческий капитал , такие вещи , как вовлечение сотрудников и инновационный потенциал , также управление сетями поставок , и трудовые и человеческие права .
Управление относится к контролю компаний их руководством и инвесторами"	Видите , я же говорил — пикантные штучки
Explicit	Comparison.Concession.Arg2-as-denier	Но	Видите , я же говорил — пикантные штучки	ЭОУ — мерило устойчивости , а инвестирование с упором на устойчивость объединяет показатели ЭОУ с финансовыми показателями в инвестиционный процесс
Explicit	Expansion.Conjunction	а	Но ЭОУ — мерило устойчивости	инвестирование с упором на устойчивость объединяет показатели ЭОУ с финансовыми показателями в инвестиционный процесс
AltLex	Expansion.Equivalence	Это означает	ЭОУ — мерило устойчивости , а инвестирование с упором на устойчивость объединяет показатели ЭОУ с финансовыми показателями в инвестиционный процесс	ограничение будущих рисков путём минимизации вреда для человека и планеты
Explicit	Expansion.Conjunction	Также	Это означает ограничение будущих рисков путём минимизации вреда для человека и планеты	это означает предоставление капитала пользователям , которые направят его в сторону продуктивных и устойчивых результатов
Explicit	Contingency.Condition.Arg2-as-cond	Если	уделяет ли этому внимание частный сектор промышленности	сегодня устойчивость развития значима в финансовом смысле , и всё говорит о том , что будет значить ещё больше завтра
Implicit	Comparison.Concession.Arg2-as-denier	but	это означает предоставление капитала пользователям , которые направят его в сторону продуктивных и устойчивых результатов	Если сегодня устойчивость развития значима в финансовом смысле , и всё говорит о том , что будет значить ещё больше завтра , уделяет ли этому внимание частный сектор промышленности
Explicit	Expansion.Conjunction	и	сегодня устойчивость развития значима в финансовом смысле	всё говорит о том , что будет значить ещё больше завтра
Explicit	Hypophora	ли	Самое замечательное , что большинство руководителей так и делают	
Implicit	Expansion.Level-of-detail.Arg2-as-detail	in particular	Самое замечательное , что большинство руководителей так и делают	Они стали рассматривать устойчивость развития не только как важный , но и как ключевой момент для успеха бизнеса
Implicit	Expansion.Level-of-detail.Arg2-as-detail	in particular	Они стали рассматривать устойчивость развития не только как важный , но и как ключевой момент для успеха бизнеса	Около 80 % руководителей в мире видят устойчивость как корень роста в инновациях и как путь к конкурентному преимуществу в своих отраслях
Implicit	Expansion.Conjunction	and	Около 80 % руководителей в мире видят устойчивость как корень роста в инновациях и как путь к конкурентному преимуществу в своих отраслях	93 % видят будущее за ЭОУ или считают важным для будущего своего бизнеса
Explicit	Expansion.Disjunction	или	93 % видят будущее за ЭОУ	считают важным для будущего своего бизнеса
Implicit	Contingency.Cause+Belief.Result+Belief	so	"Около 80 % руководителей в мире видят устойчивость как корень роста в инновациях и как путь к конкурентному преимуществу в своих отраслях .
93 % видят будущее за ЭОУ или считают важным для будущего своего бизнеса"	Взгляды руководителей ясны
Implicit	Expansion.Conjunction	and	Взгляды руководителей ясны	Существуют огромные возможности в области устойчивого развития
Implicit	Comparison.Concession.Arg2-as-denier	but	Существуют огромные возможности в области устойчивого развития	Как же компании фактически используют ЭОУ для достижения твёрдых результатов в бизнесе
AltLex	Hypophora	Как	Один пример весьма близок нашим сердцам	же компании фактически используют ЭОУ для достижения твёрдых результатов в бизнесе
Implicit	Expansion.Manner.Arg2-as-manner	this way	Как же компании фактически используют ЭОУ для достижения твёрдых результатов в бизнесе	"Один пример весьма близок нашим сердцам .
В 2012 году « Стейт Стрит » перевела 54 приложения в облачные платформы , а 85 мы вывели из доступа .
Мы виртуализировали наши операционные системы и завершили множество проектов по автоматизации .
Эти действия создают большее количество мобильных рабочих мест , сокращают рабочие площади , позволяют сохранить 23 миллиарда долларов в эксплуатационных расходах ежегодно и избежать выброса 100 000 тонн углерода .
Это равноценно тому , как если бы мы убрали 21 000 автомобилей с дорог .
Круто , верно ?
Другой пример — компания Pentair .
Pentair — американский промышленный конгломерат .
Около десяти лет назад они продали свой основной бизнес электроинструментов и направили вырученную сумму в бизнес воды .
Очень крупная ставка"
Implicit	Expansion.Level-of-detail.Arg2-as-detail	in particular	Один пример весьма близок нашим сердцам	В 2012 году « Стейт Стрит » перевела 54 приложения в облачные платформы , а 85 мы вывели из доступа
Explicit	Expansion.Conjunction	а	В 2012 году « Стейт Стрит » перевела 54 приложения в облачные платформы	85 мы вывели из доступа
Implicit	Expansion.Conjunction	and	В 2012 году « Стейт Стрит » перевела 54 приложения в облачные платформы , а 85 мы вывели из доступа	Мы виртуализировали наши операционные системы и завершили множество проектов по автоматизации
Explicit	Expansion.Conjunction	и	виртуализировали наши операционные системы	завершили множество проектов по автоматизации
Implicit	Contingency.Cause.Result	as a result	Мы виртуализировали наши операционные системы и завершили множество проектов по автоматизации	Эти действия создают большее количество мобильных рабочих мест , сокращают рабочие площади , позволяют сохранить 23 миллиарда долларов в эксплуатационных расходах ежегодно и избежать выброса 100 000 тонн углерода
Explicit	Expansion.Conjunction	и	позволяют сохранить 23 миллиарда долларов в эксплуатационных расходах ежегодно	избежать выброса 100 000 тонн углерода
Explicit	Comparison.Similarity	как	Это равноценно тому	если бы мы убрали 21 000 автомобилей с дорог
AltLex	Comparison.Similarity	Это равноценно тому , как	Эти действия создают большее количество мобильных рабочих мест , сокращают рабочие площади , позволяют сохранить 23 миллиарда долларов в эксплуатационных расходах ежегодно и избежать выброса 100 000 тонн углерода	если бы мы убрали 21 000 автомобилей с дорог
Implicit	Expansion.Conjunction	and	"Один пример весьма близок нашим сердцам .
В 2012 году « Стейт Стрит » перевела 54 приложения в облачные платформы , а 85 мы вывели из доступа .
Мы виртуализировали наши операционные системы и завершили множество проектов по автоматизации .
Эти действия создают большее количество мобильных рабочих мест , сокращают рабочие площади , позволяют сохранить 23 миллиарда долларов в эксплуатационных расходах ежегодно и избежать выброса 100 000 тонн углерода .
Это равноценно тому , как если бы мы убрали 21 000 автомобилей с дорог .
Круто , верно"	Другой пример — компания Pentair
Implicit	Expansion.Conjunction	and	Pentair — американский промышленный конгломерат	Около десяти лет назад они продали свой основной бизнес электроинструментов и направили вырученную сумму в бизнес воды
Explicit	Expansion.Conjunction	и	продали свой основной бизнес электроинструментов	направили вырученную сумму в бизнес воды
Implicit	Expansion.Equivalence	in other words	Около десяти лет назад они продали свой основной бизнес электроинструментов и направили вырученную сумму в бизнес воды	Очень крупная ставка
Implicit	Expansion.Conjunction	and	Очень крупная ставка	Почему они это сделали
AltLex	Hypophora	Почему	Да простят меня фанаты « Большого ремонта » , там больше роста в воде , чем в электроинструментах , и эта компания имеет свои виды на то , что они называют « новый Новый Мир	они это сделали
Implicit	Contingency.Cause.Reason	because	Почему они это сделали	Да простят меня фанаты « Большого ремонта » , там больше роста в воде , чем в электроинструментах , и эта компания имеет свои виды на то , что они называют « новый Новый Мир
Explicit	Expansion.Conjunction	и	там больше роста в воде , чем в электроинструментах	эта компания имеет свои виды на то , что они называют « новый Новый Мир
Implicit	Expansion.Level-of-detail.Arg2-as-detail	in particular	эта компания имеет свои виды на то , что они называют « новый Новый Мир	Это 4 миллиарда человек среднего класса , нуждающиеся в еде , энергии и воде
