rel_type	rel_sense	conn_text	arg1_text	arg2_text
Explicit	Contingency.Condition.Arg2-as-cond	net jeigu	Mes augame ant neišbaigtų idėjų	tokia idėja buvome mes patys
Implicit	Contingency.Cause.Reason	kadangi	Mes augame ant neišbaigtų idėjų, net jeigu tokia idėja buvome mes patys	Tokia yra meistriškumo dinamika
Implicit	Expansion.Level-of-detail.Arg2-as-detail	kitaip tariant	Tokia yra meistriškumo dinamika	Trokštamo dalyko priartėjimas gali padėit pasiekti daugiau nei kad drįsdavote pasvajoti
Explicit	Comparison.Concession.Arg1-as-denier	nei kad	Trokštamo dalyko priartėjimas gali padėit pasiekti daugiau	drįsdavote pasvajoti
Implicit	Expansion.Level-of-detail.Arg2-as-detail	kad	Įsivaizduoju	būtent taip galvojo Elizabeth Murray, kai vieną dieną mačiau ją besišypsančią ir žiūrinčią į tuos ankstyvuosius darbus galerijose
Explicit	Temporal.Synchronous	kai	būtent taip galvojo Elizabeth Murray	vieną dieną mačiau ją besišypsančią ir žiūrinčią į tuos ankstyvuosius darbus galerijose
Explicit	Comparison.Concession.Arg2-as-denier	bet	Užbaigimas yra tikslas	kaip mes tikime, jis niekad nėra pabaiga
